{
  "id": "mod_shield_mk2",
  "name": "Aegis Shield Generator Mk-II",
  "type": "Shield",
  "description": "A reliable mid-grade shield emitter that projects a stable energy barrier around the vessel. Standard issue on most military frigates.",
  "power_cost": 28.0,
  "mass": 5.0,
  "shield_boost": 400.0,
  "tier": 2,
  "tags": ["defense", "standard"]
}
